{
  "$schema": "https://json-schema.org/draft/2020-12/schema",
  "title": "crux refutation record (format_version 1)",
  "description": "Binds the named checks that settled a council round's blocking findings, and the result tokens those checks emitted, to seat-qualified finding ids so the gate check can read them. It applies to adr modules only. A conductor's record carries its round's reviewed subject hash; only an adjudicator's record, at an adr module's round 3, may check the subject as it stands. No vendored writer exists: the recorder names itself, so recorder identity is self-asserted.",
  "type": "object",
  "additionalProperties": false,
  "required": [
    "record_type",
    "format_version",
    "written_at",
    "book",
    "run_id",
    "module_tag",
    "council_record",
    "recorder",
    "recorder_role",
    "subjects",
    "entries"
  ],
  "properties": {
    "record_type": { "const": "refutation-record" },
    "format_version": { "const": "1" },
    "written_at": {
      "type": "string",
      "pattern": "^\\d{4}-\\d{2}-\\d{2}T\\d{2}:\\d{2}:\\d{2}\\.\\d{6}Z(?![\\s\\S])",
      "$comment": "UTC with microseconds, stamped by the recorder. The record takes its place in record order by this stamp, after the council record it names."
    },
    "book": {
      "type": "object",
      "additionalProperties": false,
      "required": ["id", "content_hash"],
      "properties": {
        "id": { "type": "string", "pattern": "^(?:(?!(?:PB|ADR|RUN|BRIEF)-)[A-Z][A-Z0-9]{1,9}-)?PB-\\d{4}(?![\\s\\S])" },
        "content_hash": { "type": "string", "pattern": "^sha256:[0-9a-f]{64}(?![\\s\\S])" }
      }
    },
    "run_id": { "type": "string", "pattern": "^RUN-\\d{3}(?![\\s\\S])" },
    "module_tag": { "type": "string", "pattern": "^adr-\\d+(?![\\s\\S])" },
    "council_record": {
      "type": "object",
      "additionalProperties": false,
      "required": ["path", "sha256"],
      "properties": {
        "path": { "type": "string", "minLength": 1, "$comment": "Repository-relative path of the council record this refutes." },
        "sha256": { "type": "string", "pattern": "^[0-9a-f]{64}(?![\\s\\S])", "$comment": "sha256 of that council record's file bytes." }
      }
    },
    "recorder": { "type": "string", "minLength": 1 },
    "recorder_role": { "type": "string", "enum": ["conductor", "adjudicator"] },
    "subjects": {
      "type": "array",
      "minItems": 1,
      "items": {
        "type": "object",
        "additionalProperties": false,
        "required": ["path", "sha256"],
        "properties": {
          "path": { "type": "string", "minLength": 1 },
          "sha256": { "type": "string", "pattern": "^[0-9a-f]{64}(?![\\s\\S])" }
        }
      },
      "$comment": "The subject hashes the checks ran against. A conductor's record must carry exactly the hashes its council record reviewed."
    },
    "entries": {
      "type": "array",
      "minItems": 1,
      "items": {
        "type": "object",
        "additionalProperties": false,
        "required": ["finding_id", "check", "expect", "result_token", "artifact", "result"],
        "$comment": "One entry per blocking finding. The result is derived from the token: result_token equal to expect is `refuted`; `verdict:INCONCLUSIVE` is `inconclusive`; any other token is `confirmed`. A recorded result that differs from the derived one refuses the record, and so do a missing token, an unknown finding id and a duplicate entry.",
        "properties": {
          "finding_id": {
            "type": "string",
            "pattern": "^(openai_top|anthropic_top|google_top):[A-Za-z0-9][A-Za-z0-9_.-]{0,63}(?![\\s\\S])"
          },
          "check": { "type": "string", "minLength": 1, "$comment": "The command or named check that was run." },
          "expect": {
            "type": "string",
            "pattern": "^(exit:-?[0-9]+|count:[0-9]+/[0-9]+|verdict:[A-Z][A-Z0-9_]*)(?![\\s\\S])",
            "$comment": "The token the check emits when the finding is refuted."
          },
          "result_token": {
            "type": "string",
            "pattern": "^(exit:-?[0-9]+|count:[0-9]+/[0-9]+|verdict:[A-Z][A-Z0-9_]*)(?![\\s\\S])",
            "$comment": "An exit code, a pass count or a named verdict the check emitted; never a verdict word the recorder writes."
          },
          "artifact": { "type": "string", "minLength": 1, "$comment": "Repository-relative path of an in-repository artifact holding the check's output." },
          "result": { "type": "string", "enum": ["refuted", "confirmed", "inconclusive"] }
        }
      }
    }
  }
}
